<?xml version="1.0" encoding="UTF-8"?>
<listacompras xmlns:xsi="http://www.w3.org/2001/XMLSchema-instance" xsi:noNamespaceSchemaLocation="ejercicio4.xsd">
    <venta>
        <ventacredito>
            <fechafinpago>2022-04-05</fechafinpago>
            <cantidad>5</cantidad>
        </ventacredito>
    </venta>
    <venta>
        <ventainmediata>
            <cantidad> 7 </cantidad>
            <divisa> 43000 </divisa>
        </ventainmediata>
    </venta>
</listacompras>